{
 "goal": "分析黄金对当前持仓的风险暴露与风险点",
 "entity": "分析黄金对当前持仓的风险暴露与风险点",
 "generatedAt": "2026-09-03T18:56:57",
 "summary": "当前持仓中直接相关头寸为华安黄金ETF（518880），持有200股，市值2,695.6元，占账户总资产的14.42%，系账户内唯一有市值的权益类持仓，因此金价波动会对账户净值产生直接影响。现价约13.478元/股，相对9.1895元成本已有较高浮盈，需警惕利润回吐风险。主要暴露于黄金价格本身的系统性波动，以及影响金价的宏观因子（实际利率、美元指数、地缘风险等）。由于持仓占比接近15%，集中度风险中等偏高；但账户保留85%以上现金，整体风险缓冲能力尚可。无其他板块头寸，故间接联动风险较低，核心风险集中在黄金单一资产价格走势。",
 "holdingsExposure": {
  "total": 3,
  "exposed": [
   {
    "code": "518880",
    "name": "华安黄金ETF",
    "marketCode": "518880.SS",
    "relation": "同属黄金板块",
    "shares": 200,
    "avgCost": 9.1895,
    "price": 8.902,
    "value": 1780.4,
    "valueNote": null,
    "weightPct": 9.53
   }
  ],
  "portfolio": {
   "totalAssets": 18690.61,
   "onMarketValue": 2695.6,
   "cashAvailable": 15511.11,
   "positionPct": 14.42,
   "asOf": "2026-09-01"
  }
 },
 "riskPoints": [
  {
   "risk": "黄金价格单边下跌风险，因直接持有黄金ETF且该持仓占账户净资产14.42%，为当前唯一权益暴露，金价回调将直接侵蚀账户资产和浮盈",
   "severity": "high",
   "rationale": "持仓规模相对账户占比较高，且成本价显著低于现价，若金价自高位回落，不仅产生市值亏损，还会引致浮盈缩水。黄金ETF与金价几乎完全联动，无其他头寸对冲。",
   "watch": "关注国际金价是否出现趋势性下行突破关键支撑（以近月低点为参考），以及实际利率和美元指数的方向性变化"
  },
  {
   "risk": "宏观货币政策收紧风险：美联储推迟降息或转为加息将推高实际利率，抑制黄金持有吸引力，导致金价下行",
   "severity": "medium",
   "rationale": "2025年以来黄金涨幅与降息预期和实际利率下行相关，若通胀回升或就业韧性使美联储政策转向，黄金价格将受到压制，直接影响本持仓。",
   "watch": "关注美国CPI、非农就业数据、点阵图及美联储官员最新表态，尤其是实际利率（TIPS收益率）是否快速上行"
  },
  {
   "risk": "高位波动性风险：当前浮盈较大，金价处于历史相对高位，市场情绪转变可能引发剧烈双向波动，持仓市值波动加大",
   "severity": "medium",
   "rationale": "成本较低、盈利状态下，价格回调时投资者心理承受压力较大；且黄金在避险与风险偏好切换中呈现高波动特征，短期事件可能造成过大回撤。",
   "watch": "关注市场避险情绪指标（VIX、央行购金动态）及突发事件是否导致金价单日波动超过2%"
  },
  {
   "risk": "汇率风险（人民币计价）：沪金以人民币定价，若国内金价相对国际金价偏离（受汇率和溢价影响），存在价差波动风险",
   "severity": "low",
   "rationale": "账户以人民币计价，华安黄金ETF跟踪国内金价，人民币汇率波动会传导至国内金价，但其与美元计价黄金走势基本一致，汇率影响在可控范围。",
   "watch": "关注离岸人民币汇率及沪金与国际金价价差是否出现极端走阔或收窄"
  }
 ],
 "watchlist": [
  {
   "text": "美联储9月议息会议（2026年9月16-17日）结果及利率路径指引",
   "trigger": "若降息预期进一步延迟或出现加息暗示，则金价承压风险上升；若强化宽松预期，则金价短期获支撑但高位波动风险仍存"
  },
  {
   "text": "美国实际利率（10年期TIPS收益率）走势",
   "trigger": "实际利率快速上行意味着黄金投资机会成本增加，金价下跌概率增大；实际利率下行则有利于黄金持仓保值增值"
  },
  {
   "text": "美元指数变化",
   "trigger": "美元指数走强通常压制金价，若美元指数突破近期高点则需警惕黄金回调；美元走弱则对金价形成支撑"
  },
  {
   "text": "地缘政治与避险情绪变动（如中东局势、全球贸易摩擦等）",
   "trigger": "突发事件可能引发金价脉冲式上涨，但随后可能快速回落，需警惕追高风险和波动率放大"
  },
  {
   "text": "央行黄金储备及ETF资金持仓变化",
   "trigger": "机构持续增持或减持可反映中长期趋势，若出现连续大额减持则可能触发价格下行拐点"
  }
 ],
 "compliance": {
  "passed": true,
  "note": "仅研究/风险识别用途：本报告不含任何交易指令、买卖建议或操作提示。"
 },
 "_meta": {
  "agent_type": "portfolio_risk",
  "llm_used": true,
  "generated_at": "2026-09-03T18:56:57",
  "schema_valid": true,
  "job_id": "13ee14634e3346deb139ffc39417cbba"
 }
}