{
 "goal": "黄金价格波动对当前持仓的影响与风险",
 "entity": "黄金价格波动对当前持仓的影响与风险",
 "generatedAt": "2026-09-03T18:42:23",
 "summary": "评估目标为黄金价格波动对账户影响。当前账户直接持有华安黄金ETF（518880）200份，市值2,695.6元（占账户14.42%），为该账户唯一证券头寸，同时现金占比约83%。黄金价格波动与持仓净值呈高度正相关，直接影响账户市值及浮盈（成本9.1895，现价约13.478，浮盈约46.7%）。主要风险在于金价若回落，浮盈将明显收窄；且组合集中于单一商品，缺乏其他资产对冲。账户现金比例高，为潜在增配能力，但不可视为风险分散。需重点关注宏观利率与美元走势、避险情绪变化及ETF流动性情况。当前关注度中等偏高。",
 "holdingsExposure": {
  "total": 3,
  "exposed": [
   {
    "code": "518880",
    "name": "华安黄金ETF",
    "marketCode": "518880.SS",
    "relation": "同属黄金板块",
    "shares": 200,
    "avgCost": 9.1895,
    "price": 8.902,
    "value": 1780.4,
    "valueNote": null,
    "weightPct": 9.53
   }
  ],
  "portfolio": {
   "totalAssets": 18690.61,
   "onMarketValue": 2695.6,
   "cashAvailable": 15511.11,
   "positionPct": 14.42,
   "asOf": "2026-09-01"
  }
 },
 "riskPoints": [
  {
   "risk": "金价高位回撤风险：黄金ETF净值随金价波动剧烈，当前持仓浮盈约46.7%，价格回调将直接侵蚀利润",
   "severity": "high",
   "rationale": "账户以9.1895元成本持有200份华安黄金ETF，现价约13.478元，浮盈比例较高。该ETF紧密跟踪国内金价，若国际金价出现5%-10%的回调，账户盈利将大幅缩水，对净值冲击明显。",
   "watch": "关注国际现货黄金（伦敦金/纽约金）是否跌破近期关键支撑位，如前期斐波那契回撤位或月线均线支撑。"
  },
  {
   "risk": "品种集中度风险：账户除现金外仅持有黄金ETF，缺乏股票、债券等资产对冲",
   "severity": "medium",
   "rationale": "黄金ETF市值占账户总资产14.42%，虽非绝对主导，但组合实质风险敞口集中于单一商品板块，未与其他资产形成分散。若黄金市场出现流动性紧缺或极端事件，组合抗风险能力较弱。",
   "watch": "监控账户持仓结构变化，若黄金仓位占比显著上升而其他资产未增配，则集中度风险加剧。"
  },
  {
   "risk": "宏观利率与美元联动风险：美联储政策或美债收益率变动可能引发金价反向波动",
   "severity": "medium",
   "rationale": "黄金定价核心受美元实际利率和美元指数影响。若美联储释放鹰派信号或经济数据强劲导致实际利率上行，黄金作为非生息资产的吸引力下降，ETF净值将承压。当前账户对该宏观路径缺乏保护。",
   "watch": "关注美国10年期TIPS收益率、联邦基金利率期货隐含加息概率及美元指数（DXY）走势。"
  },
  {
   "risk": "避险情绪逆转风险：地缘政治缓和或市场风险偏好回升将削弱黄金的避险需求",
   "severity": "low",
   "rationale": "黄金常在地缘冲突或经济不确定性时期获得避险买盘。若国际局势意外转好、决策者达成协议或股市大幅上涨，市场风险偏好回升，黄金配置资金可能流出，拖累ETF价格。该风险当前可能性较低，但仍需关注突发转变。",
   "watch": "跟踪全球主要地缘政治事件（如俄罗斯/乌克兰、中东局势）进展，以及VIX指数、全球主要股指风险偏好指标。"
  },
  {
   "risk": "ETF流动性及折溢价风险：极端行情下场内交易价格可能与净值偏离或成交不畅",
   "severity": "low",
   "rationale": "华安黄金ETF为场内流动性较好的产品，但在极端冲击下（如金价单日暴涨/暴跌、熔断或系统异常），可能出现流动性不足或折溢价扩大，导致持有者以非公允价值变现，造成额外损失。目前仓位不高，影响有限。",
   "watch": "观察该ETF的日成交额、买卖价差及IOPV（基金份额参考净值）折溢价率是否异常扩大。"
  }
 ],
 "watchlist": [
  {
   "text": "国际现货黄金价格及COMEX黄金期货收盘价",
   "trigger": "若出现连续单日波动超过2%或跌破关键整数关口，意味波动风险上升"
  },
  {
   "text": "COMEX黄金期货非商业净多头持仓（CFTC周报）",
   "trigger": "若净多头持仓快速减少，可能预示市场情绪转向或挤兑风险"
  },
  {
   "text": "美国10年期国债实际收益率（TIPS）",
   "trigger": "若实际收益率单周上升超过30个基点，金价承压概率大幅增加"
  },
  {
   "text": "美元指数DXY",
   "trigger": "若美元指数突破近期高点并持续走强，将抑制黄金表现"
  },
  {
   "text": "重大地缘政治事件强度及概率评估",
   "trigger": "若冲突升级或谈判突然破裂，避险需求可能推高金价，反之回落"
  },
  {
   "text": "华安黄金ETF的成交额与折溢价率",
   "trigger": "若成交额显著萎缩或折溢价率超过1%，需警惕流动性损耗风险"
  }
 ],
 "compliance": {
  "passed": true,
  "note": "仅研究/风险识别用途：本报告不含任何交易指令、买卖建议或操作提示。"
 },
 "_meta": {
  "agent_type": "portfolio_risk",
  "llm_used": true,
  "generated_at": "2026-09-03T18:42:23",
  "schema_valid": true,
  "job_id": "077b6f3e3b084c9d8c85721d881aced3"
 }
}